{"actualRuntimeEvaluation":{"aggregate":{"candidatePassCount":2,"failToPassCount":1,"parentPassCount":1,"passToFailCount":0,"promotionSignal":false,"researchMetric":false,"taskCount":2},"executionBundleHash":"sha256:d80841fbd3a3d985f83dd38ac1f96e0314ec490eeea14a36e9ea4d4f3638a2ec","resultHash":"sha256:f9791d0c8c3e7c774c64f0000364ec5a7c40f3ba1cd65083b8098d52767ae995","sourceClass":"derived_from_actual_standalone_runtime_evidence"},"artifacts":{"candidateClosure":{"componentEntries":[{"componentManifest":{"componentManifestId":"cm-sha256:183ef27ae3fbb7e7bc170b045f063b3c582c714a345fa527691fcd7623755880","identity":{"behaviorClosure":{"artifactCount":1,"canonicalBytes":837,"closureHash":"sha256:8ad0777bb85e5ae0e40cd79a9b4a7697b9efa679155356cee684fbaee4252d54","componentCount":1},"canonicalizationProfile":"seh-c14n-int-v1","componentId":"component.workflow.os-boundary-development","componentIntrinsicId":"ci-sha256:577b7636f15d83ab929835af5e9b7bd8d64524c16b3a7f07fc897a93c35540b2","dependencies":[],"payload":{"artifact":{"contentHash":"sha256:ea6ee3567a627f832a9fb1876b7f686bb8cf68b8ec6e65f9116273e7eb75a2b8","mediaType":"application/vnd.seh.workflow+json","redacted":false,"sizeBytes":301},"capabilityDigest":"sha256:5ea2802eddcdcda553a60d8f35e8837ce96bd04e51a5a63bde7fee54fb818c26","capabilityIds":["workflow.dispatch.closed-action"],"language":"seh.workflow.v1"},"semanticVersion":"1.1.0","typeRegistryRef":{"typeEntryId":"type.workflow-policy","typeRegistryHash":"sha256:93d1ce4068c4b12a2a35a51d673fbd64b6b1dfba6d024b9ae8b937010852403c","typeRegistryId":"ctr-sha256:93d1ce4068c4b12a2a35a51d673fbd64b6b1dfba6d024b9ae8b937010852403c"}},"schemaVersion":3},"payload":{"entryState":"start","language":"seh.workflow.v1","schemaVersion":1,"states":[{"actions":[],"stateId":"start"},{"actions":[{"action":"model_turn","targetId":null}],"stateId":"work"}],"terminalStates":["work"],"transitions":[{"from":"start","guard":"always","to":"work","trigger":"action_succeeded"}]}},{"componentManifest":{"componentManifestId":"cm-sha256:ba67cca7376898529124664b8b94a0b3f3edd17bb57c4e819eece90c779373df","identity":{"behaviorClosure":{"artifactCount":1,"canonicalBytes":641,"closureHash":"sha256:e21dc2c6c648d6523fecdfc0f9dabfe34a9772988733399ee4cce38c4fc4ff9b","componentCount":1},"canonicalizationProfile":"seh-c14n-int-v1","componentId":"component.permission.os-boundary-development","componentIntrinsicId":"ci-sha256:68db6425a39a282aaf4e1c8cf0b10af69a5db08f33ce995c2dd8e5f32826a894","dependencies":[],"payload":{"artifact":{"contentHash":"sha256:61fe04de13d2511492c448c6c857fababb685fedef374d4806d99e91b9dcae4c","mediaType":"application/vnd.seh.policy+json","redacted":false,"sizeBytes":107},"capabilityDigest":"sha256:a8ce32167e71384c9f88506a1d2777ee0d30dd5a032045a1112b2abdde00320e","capabilityIds":["permission.authorize"],"language":"seh.policy-json.v1"},"semanticVersion":"1.0.0","typeRegistryRef":{"typeEntryId":"type.permission-policy","typeRegistryHash":"sha256:93d1ce4068c4b12a2a35a51d673fbd64b6b1dfba6d024b9ae8b937010852403c","typeRegistryId":"ctr-sha256:93d1ce4068c4b12a2a35a51d673fbd64b6b1dfba6d024b9ae8b937010852403c"}},"schemaVersion":3},"payload":{"language":"seh.policy-json.v1","policy":{"fixed":true},"policyType":"PermissionPolicy","schemaVersion":1}}],"harnessManifest":{"harnessVersionId":"hv-sha256:5f2c643e6b4549a11b6a5a443a246fc987792c0457964830b83beb6aabad9073","identity":{"behaviorClosure":{"artifactCount":2,"canonicalBytes":1420,"closureHash":"sha256:f255c71df2f95b3913ce16f3a081ccb98dc83b3f5825309c02e67689e4cfb07b","componentCount":2},"canonicalizationProfile":"seh-c14n-int-v1","componentBindings":[{"component":{"componentId":"component.permission.os-boundary-development","componentManifestId":"cm-sha256:ba67cca7376898529124664b8b94a0b3f3edd17bb57c4e819eece90c779373df","manifestHash":"sha256:ba67cca7376898529124664b8b94a0b3f3edd17bb57c4e819eece90c779373df","semanticVersion":"1.0.0","typeEntryId":"type.permission-policy"},"slotId":"permission"},{"component":{"componentId":"component.workflow.os-boundary-development","componentManifestId":"cm-sha256:183ef27ae3fbb7e7bc170b045f063b3c582c714a345fa527691fcd7623755880","manifestHash":"sha256:183ef27ae3fbb7e7bc170b045f063b3c582c714a345fa527691fcd7623755880","semanticVersion":"1.1.0","typeEntryId":"type.workflow-policy"},"slotId":"workflow"}],"requiredRuntimeContractHash":"sha256:b812dd62754383520141a5a53102f15fc900c74a17524a3402513919f04988dc","semanticVersion":"1.1.0","typeRegistryId":"ctr-sha256:93d1ce4068c4b12a2a35a51d673fbd64b6b1dfba6d024b9ae8b937010852403c"},"manifestHash":"sha256:5f2c643e6b4549a11b6a5a443a246fc987792c0457964830b83beb6aabad9073","schemaVersion":2}},"candidateEvaluation":{"aggregate":{"candidatePassCount":2,"failToPassCount":1,"parentPassCount":1,"passToFailCount":0,"promotionSignal":false,"researchMetric":false,"taskCount":2},"attestation":{"algorithm":"Ed25519","keyId":"evaluator.development-os.evaluator.ed25519","signature":"53ch63AcGpbgyG5bFwMdQGlxkcnH6Cwt5k9HH9zc3z1plpRD70XKPnXE8bTbWfJ2D5UQkUbb1Wt6gJAYzx7hCw"},"candidateHarnessVersionId":"hv-sha256:5f2c643e6b4549a11b6a5a443a246fc987792c0457964830b83beb6aabad9073","evaluatedAt":"2026-07-31T13:08:00.000Z","evaluator":{"identityDigest":"sha256:a5d3a61e2e764230b59a06b36e704fe2034f8ff3164040617f4f129efd5a86e3","implementationDigest":"sha256:2facc50f0adcd7abe251bebd7721acf1bd4c4b237f2bf84598da5e33839c68fc","instanceId":"evaluator.development-os.evaluator.instance","principalId":"evaluator.development-os.evaluator","role":"evaluator"},"executionBundleHash":"sha256:d80841fbd3a3d985f83dd38ac1f96e0314ec490eeea14a36e9ea4d4f3638a2ec","lifecycleBoundary":{"approvedAllowed":false,"canaryAllowed":false,"deploymentAllowed":false,"promotable":false,"researchSelectionAllowed":false,"state":"evaluated_development"},"nonPromotableRecordHash":"sha256:1e3af895021d996aab4867d26fc35b2cd7e5f0567d5e0d8dee56e99a6ed8a69e","publicPrincipal":{"identity":{"identityDigest":"sha256:a5d3a61e2e764230b59a06b36e704fe2034f8ff3164040617f4f129efd5a86e3","implementationDigest":"sha256:2facc50f0adcd7abe251bebd7721acf1bd4c4b237f2bf84598da5e33839c68fc","instanceId":"evaluator.development-os.evaluator.instance","principalId":"evaluator.development-os.evaluator","role":"evaluator"},"keyId":"evaluator.development-os.evaluator.ed25519","publicKeyPem":"-----BEGIN PUBLIC KEY-----\nMCowBQYDK2VwAyEAJB2koG7fujx+O2Ls18+H+OCvZ13Fb7UTwxz39awxwR0=\n-----END PUBLIC KEY-----\n"},"resultHash":"sha256:f9791d0c8c3e7c774c64f0000364ec5a7c40f3ba1cd65083b8098d52767ae995","resultId":"development.os-boundary.evaluation.v1","schemaVersion":1,"sourceClass":"derived_from_actual_standalone_runtime_evidence"},"finalReceipt":{"absentCapabilityClasses":["candidate_evaluator_key","mutation_proposer_key","network","operations_key","oracle","promotion"],"accessibleMountClasses":["audit_key","development_artifact_graph","role_receipts_read_only"],"action":"finalize_evidence","attestation":{"algorithm":"Ed25519","keyId":"audit_store.development-os.audit.ed25519","signature":"hrjDDRIsTe3cN27OLCG_eBeDaqynf9s4uBMhPDz9i8BH2cE8C4fXTnI-xNX8id6hqN8fya0KjgTsLCf1fooRBA"},"authorizedForResearchEvidence":false,"completedAt":"2026-07-31T13:09:00.000Z","developmentOnly":true,"inputHashes":["sha256:0899413f6816ae4fe4d534849fef3a963763c828e76325d8a3813906028e35b2","sha256:4ceb1777c8cb6d0273e246bf15f2717639ce2eea967d0d061b5f6f1855b1f584","sha256:66d145373d1baedcd2f4248f6347d87cfc62f47744769b8409dd784a8c52613b","sha256:6e8ef7e0e6d6a2856ad0a389949df71b167e70edb8bbd1544aa3e94da4e8f4d2","sha256:9097dfe3d2f2784ba894253a736581c356e14525e490806bd4decaac7234ad5e","sha256:ae86d4e5242a83c023aa6ca3af90243ec6f86640ccdd066b022f0954ad8a2580","sha256:da1b9bf67987e4210e13969612e0e5e5c8f76ab2717ae093560c9b6437913a42","sha256:e5727fe22852b6846020d65b60d8bd3ab28c5bcc642c187f375c39ad45b8c373"],"outputHashes":["sha256:12e7958b4cf85e841ae8a7c9b643e35d8709c2710d7e553c5c0de8a2bc76a3d2"],"process":{"gid":1208,"isolationClass":"os_enforced_subordinate_uid","uid":1208},"producer":{"identityDigest":"sha256:ca4b9a0d6dcc56fefa567c68992821b705c262d99fd13373ac2a7acbcd55b82f","implementationDigest":"sha256:122ea687b7c404a6642fbee2023aede017840d3af0ee7d183559c06a4253acf2","instanceId":"audit_store.development-os.audit.instance","principalId":"audit_store.development-os.audit","role":"audit_store"},"publicPrincipal":{"identity":{"identityDigest":"sha256:ca4b9a0d6dcc56fefa567c68992821b705c262d99fd13373ac2a7acbcd55b82f","implementationDigest":"sha256:122ea687b7c404a6642fbee2023aede017840d3af0ee7d183559c06a4253acf2","instanceId":"audit_store.development-os.audit.instance","principalId":"audit_store.development-os.audit","role":"audit_store"},"keyId":"audit_store.development-os.audit.ed25519","publicKeyPem":"-----BEGIN PUBLIC KEY-----\nMCowBQYDK2VwAyEASpUqIyeCY5jwz3hT3LkMGvFg6DDiqslfJCtDSbnvbzs=\n-----END PUBLIC KEY-----\n"},"receiptHash":"sha256:e173b19ddda0d14b32d691d955ee70f3ae590ff4f073957883d1dfd2ac3dade0","receiptId":"development.os-boundary.audit-finalize","receiptType":"development_boundary_role_execution","roleName":"audit","schemaVersion":1,"startedAt":"2026-07-31T13:09:00.000Z","success":true},"labelBlindCorpus":{"corpusHash":"sha256:49f7dcbfaabdc122294b41f30d56f15d5eca6088d7941f07483968bdd58e1a01","schemaVersion":1,"traces":[{"occurrenceCount":1,"trace":{"observations":[{"epistemicClass":"recorded_observation","eventType":"session_state_changed","facts":{"from":"created","to":"initialized"},"ordinal":0,"originClass":"runtime"},{"epistemicClass":"recorded_observation","eventType":"session_state_changed","facts":{"from":"initialized","to":"running"},"ordinal":1,"originClass":"runtime"},{"epistemicClass":"recorded_observation","eventType":"task_submitted","facts":{},"ordinal":2,"originClass":"user"},{"epistemicClass":"recorded_observation","eventType":"context_constructed","facts":{"entryCounts":{"selected_memory:selected:selected":1,"selected_skills:selected:selected":1,"system_prompt:selected:selected":1,"task_input:selected:selected":1,"tool_cata